Article,Point,Content
Art. 143,15,"W przypadku podjęcia wobec członka Komisji uchwały, o której mowa w art. 21 ust. 1, art. 22 ust. 1, art. 25 ust. 1 i 2 lub art. 147 ust. 1, od której w terminie nie wniesiono odwołania albo którą odpowiednio Sejm albo Prezydium Sejmu utrzymało w mocy - poseł traci członkostwo w Komisji. W takim przypadku przepisy ust. 1-13 stosuje się odpowiednio."
Art. 144,1,"Posiedzenia Komisji Etyki Poselskiej, na których rozpatruje się sprawy wynikające z majątkowych oświadczeń poselskich, są zamknięte. Przepisu art. 154 ust. 1 nie stosuje się."
Art. 144,1," Uchwały Komisji w sprawach, o których mowa w ust. 1, zapadają bezwzględną większością głosów w obecności co najmniej połowy liczby członków Komisji."
Art. 144,2,(uchylony) 52)
Art. 145,1,"Komisja w sprawach posłów, którzy zachowują się w sposób nieodpowiadający godności posła, wydaje rozstrzygnięcia na podstawie ""Zasad etyki poselskiej""."
Art. 145,2,"""Zasady etyki poselskiej"" podlegają zatwierdzeniu przez Sejm. Sejm w uchwale przyjmuje lub odrzuca w całości projekt ""Zasad etyki poselskiej"" przedstawiony przez Komisję."
Art. 145,3,"53) Pracami Komisji kieruje przewodniczący, a w czasie jego nieobecności zastępca przewodniczącego. Funkcję przewodniczącego Komisji i zastępcy przewodniczącego pełnią kolejno, po 6 miesięcy, członkowie Komisji."
Art. 145,4,"Komisja rozpatruje sprawy, które należą do jej właściwości, z własnej inicjatywy."
Art. 145,5,"W posiedzeniu Komisji nie bierze udziału członek Komisji, którego sprawa jest rozpatrywana, z zastrzeżeniem art. 146."
Art. 146,,Komisja może wezwać posła do wyjaśnienia wątpliwości powstałych w toku postępowania.
Art. 147,1,"Komisja, po rozpatrzeniu sprawy i stwierdzeniu naruszenia przez posła ""Zasad etyki poselskiej"", może w drodze uchwały:"
Art. 147,2,Uchwały Komisji podaje się do wiadomości publicznej.
Art. 147,3,"Uchwałę, o której mowa w ust. 1 pkt 2 i 3, Komisja podejmuje bezwzględną większością głosów w obecności co najmniej połowy jej członków."
Art. 147,4,"Od uchwały, o której mowa w ust. 1, służą posłowi środki przewidziane w art. 132 ust. 2 Regulaminu Sejmu. Wniesienie przez posła odwołania wstrzymuje podanie treści uchwały do wiadomości publicznej."
Art. 147a,1,"Komisja Etyki Poselskiej uchwala projekt regulaminu Komisji określającego szczegółowy tryb działania i pracy Komisji oraz podejmowania przez nią rozstrzygnięć, w szczególności zasady sprawowania funkcji przewodniczącego Komisji i jego zastępcy oraz podawania do wiadomości publicznej uchwał Komisji, o których mowa w art. 147 ust. 1."
Art. 148,,"Z uwzględnieniem zmian wynikających z przepisów niniejszego rozdziału, do Komisji Etyki Poselskiej i posłów do niej wybranych stosuje się odpowiednio przepisy Regulaminu Sejmu."
Art. 148a,2,"Skład Komisji do Spraw Unii Europejskiej, zwanej dalej w niniejszym rozdziale ""Komisją"", powinien odzwierciedlać proporcjonalnie reprezentację w Sejmie klubów i porozumień liczących co najmniej 15 posłów, z zastrzeżeniem ust. 7."
Art. 148a,3,Prezydium Sejmu ustala liczbę członków klubu lub porozumienia wchodzących w skład Komisji według następujących zasad:
Art. 148a,1,"obliczając współczynnik jako iloraz liczby członków klubu lub porozumienia i liczby 460, z dokładnością do trzeciego miejsca po przecinku,"
Art. 148a,2,"mnożąc współczynnik przez liczbę 46, z dokładnością do pierwszego miejsca po przecinku,"
Art. 148a,3,"zaokrąglając iloczyn, o którym mowa w pkt 2, do liczby całkowitej, na zasadach ogólnych."
Art. 148a,5,"Prezydium Sejmu powiadamia kluby lub porozumienia o podziale miejsc przeprowadzonym z zastosowaniem zasad, o których mowa w ust. 3."
Art. 148a,6,Kluby i porozumienia zgłaszają Prezydium Sejmu kandydatów do Komisji w liczbie i w terminie określonych przez Prezydium Sejmu.
Art. 148a,7,"W przypadku niezgłoszenia przez klub lub porozumienie kandydatów do Komisji, w terminie, o którym mowa w ust. 6, a także w przypadku zgłoszenia większej liczby kandydatów niż liczba ustalona przez Prezydium Sejmu na podstawie ust. 3, miejsca w Komisji przypadające tym klubom i porozumieniom pozostają nieobsadzone."
Art. 148a,8,"Sejm podejmuje uchwałę o wyborze składu osobowego Komisji, w głosowaniu łącznym, na wniosek Prezydium Sejmu."
Art. 148a,9,"W przypadku, o którym mowa w ust. 7, a także w przypadku zgłoszenia przez klub lub porozumienie mniejszej liczby kandydatów niż liczba ustalona przez Prezydium Sejmu na podstawie ust. 3, kluby lub porozumienia mogą uzupełnić skład Komisji w innym terminie niż termin, o którym mowa w ust. 6. W takim przypadku Sejm przeprowadza wybór uzupełniający skład Komisji. Przepisu ust. 8 nie stosuje się."
Art. 148a,10,"W przypadku gdy nastąpi zmiana liczebności klubu lub porozumienia w stopniu powodującym zmianę podziału miejsc w Komisji ze względu na zasady, o których mowa w ust. 3, albo w przypadku utworzenia nowego klubu lub porozumienia, Sejm dokonuje wyboru nowego składu osobowego Komisji. Przepisy ust. 3-9 stosuje się odpowiednio. Uchwała Sejmu o wyborze nowego składu osobowego Komisji jest równoznaczna z odwołaniem jej poprzedniego składu osobowego."
Art. 148a,11,"W przypadku powołania Komisji w nowym składzie osobowym, o którym mowa w ust. 10, członkowie prezydium Komisji, którzy zostali wybrani ponownie do składu Komisji, zachowują swoje funkcje."
Art. 148a,12,Prezydium Sejmu na wniosek klubu lub porozumienia przedstawia Sejmowi propozycje zmian w składzie osobowym Komisji polegające na zastąpieniu członka Komisji przez inną osobę wchodzącą w skład tego klubu lub porozumienia. Do głosowania nad propozycjami zmian w składzie osobowym Komisji przepisu ust. 8 nie stosuje się.
Art. 148b,1,Marszałek Sejmu kieruje do Komisji niezwłocznie po otrzymaniu:
Art. 148b,1,"informację Rady Ministrów o udziale Rzeczypospolitej Polskiej w pracach Unii Europejskiej,"
Art. 148b,2,"dokumenty Unii Europejskiej podlegające konsultacjom z państwami członkowskimi oraz ich oceny sformułowane przez właściwe instytucje lub inne organy Unii Europejskiej,"
Art. 148b,3,"plany pracy Rady, roczne plany legislacyjne Komisji Europejskiej oraz oceny rocznych planów legislacyjnych Komisji Europejskiej sporządzone przez Parlament Europejski i Radę,"
Art. 148b,4,"projekty aktów prawnych Unii Europejskiej,"
Art. 148b,5,"informacje Rady Ministrów o przebiegu procedur stanowienia prawa Unii Europejskiej oraz o stanowiskach Rzeczypospolitej Polskiej zajmowanych w trakcie tych procedur,"
Art. 148b,6,"informację Rady Ministrów o stanowisku Rzeczypospolitej Polskiej, jakie Rada Ministrów ma zamiar zająć podczas rozpatrywania projektu w Radzie, wraz z uzasadnieniem stanowiska Rzeczypospolitej Polskiej, a także oceną skutków prawnych aktu prawnego dla polskiego systemu prawa oraz skutków społecznych, gospodarczych i finansowych dla Rzeczypospolitej Polskiej,"
Art. 148b,7,"projekty umów międzynarodowych, których stroną mają być Unia Europejska lub Europejska Wspólnota Energii Atomowej,"
Art. 148b,8,"projekty decyzji przedstawicieli rządów państw członkowskich zebranych w Radzie,"
Art. 148b,9,"projekty aktów Unii Europejskiej niemających mocy prawnej, w szczególności propozycje wytycznych przyjmowanych w sferze unii gospodarczej i pieniężnej oraz w sferze zatrudnienia,"
Art. 148b,10,"akty Unii Europejskiej mające znaczenie dla wykładni lub stosowania prawa Unii Europejskiej,"
Art. 148b,11,"propozycje kandydatur na stanowiska członka Komisji Europejskiej, członka Trybunału Obrachunkowego, sędziego Trybunału Sprawiedliwości Unii Europejskiej, rzecznika generalnego Trybunału Sprawiedliwości Unii Europejskiej, członka Komitetu Ekonomiczno-Społecznego, członka Komitetu Regionów, dyrektora w Europejskim Banku Inwestycyjnym oraz Stałego Przedstawiciela Rzeczypospolitej Polskiej przy Unii Europejskiej,"
Art. 148b,11," propozycje zmian Traktatu o Unii Europejskiej i Traktatu o funkcjonowaniu Unii Europejskiej,"
Art. 148b,11," projekty decyzji Rady Europejskiej upoważniających Radę do zmiany sposobu głosowania, o których mowa w art. 48 ust. 7 Traktatu o Unii Europejskiej,"
Art. 148b,11," wnioski Komisji Europejskiej w sprawie środków dotyczących prawa rodzinnego mających skutki transgraniczne, o których mowa w art. 81 ust. 3 Traktatu o funkcjonowaniu Unii Europejskiej,"
Art. 148b,11," informacje o wnioskach o członkostwo w Unii Europejskiej,"
Art. 148b,11," sprawozdania Komisji Europejskiej w sprawie stosowania art. 5 Traktatu o Unii Europejskiej,"
Art. 148b,11," sprawozdania roczne Trybunału Obrachunkowego,"
Art. 148b,12,inne dokumenty związane z zakresem przedmiotowym działania Komisji do Spraw Unii Europejskiej.
Art. 148b,2,"Kierując do Komisji dokumenty, Marszałek Sejmu ustala, biorąc pod uwagę terminy określone w odrębnych przepisach, kalendarz prac w Sejmie nad:"
Art. 148b,1,"dokumentami Unii Europejskiej podlegającymi konsultacjom z państwami członkowskimi,"
Art. 148b,2,"projektami aktów prawnych Unii Europejskiej,"
Art. 148b,3,"informacjami Rady Ministrów o stanowiskach Rzeczypospolitej Polskiej, jakie Rada Ministrów ma zamiar zająć podczas rozpatrywania projektów w Radzie,"
Art. 148b,4,"propozycjami kandydatur na stanowiska, o których mowa w ust. 1 pkt 11."
Art. 148b,3,"W sprawach, o których mowa w ust. 2, przekroczenie przez Komisję terminów ustalonych w kalendarzu prac w Sejmie zamyka postępowanie w sprawie."
Art. 148b,4,"Kierując do Komisji dokumenty, Marszałek Sejmu ustala, biorąc pod uwagę określone w odrębnych przepisach terminy na zgłoszenie przez Sejm sprzeciwu, kalendarz prac w Sejmie nad:"
Art. 148b,1,"inicjatywami Rady Europejskiej w sprawie decyzji upoważniającej Radę do zmiany sposobu głosowania, o której mowa w art. 48 ust. 7 Traktatu o Unii Europejskiej,"
Art. 148b,2,"wnioskami Komisji Europejskiej w sprawie środków dotyczących prawa rodzinnego mających skutki transgraniczne, o których mowa w art. 81 ust. 3 Traktatu o funkcjonowaniu Unii Europejskiej."
Art. 148c,1,"Komisja może uchwalić opinię o projekcie aktu prawnego Unii Europejskiej, opinię o stanowiskach Rzeczypospolitej Polskiej zajmowanych w trakcie procedur stanowienia prawa Unii Europejskiej, a także opinię w sprawie informacji Rady Ministrów o stanowisku Rzeczypospolitej Polskiej, jakie Rada Ministrów ma zamiar zająć podczas rozpatrywania projektu w Radzie."
Art. 148c,2,Opinia zawiera stanowisko Komisji w postaci akceptacji lub braku akceptacji stanowiska Rady Ministrów. Komisja może sformułować w opinii zalecenia dla Rady Ministrów.
Art. 148ca,1,"Po rozpatrzeniu inicjatywy Rady Europejskiej w sprawie decyzji upoważniającej Radę do zmiany sposobu głosowania, o której mowa w art. 48 ust. 7 Traktatu o Unii Europejskiej, Komisja może wnieść projekt uchwały o wyrażeniu sprzeciwu wobec tej decyzji."
Art. 148ca,2,"Pierwsze czytanie projektu uchwały, o którym mowa w ust. 1, przeprowadza się na posiedzeniu Sejmu."
Art. 148ca,3,"Do projektu uchwały, o którym mowa w ust. 1, nie można zgłaszać poprawek w czasie drugiego czytania."
Art. 148ca,4,"W przypadku przyjęcia uchwały, o której mowa w ust. 1, Marszałek Sejmu notyfikuje sprzeciw właściwemu organowi Unii Europejskiej."
Art. 148cb,1,"Po rozpatrzeniu wniosku Komisji Europejskiej w sprawie środków dotyczących prawa rodzinnego mających skutki transgraniczne, o których mowa w art. 81 ust. 3 Traktatu o funkcjonowaniu Unii Europejskiej, Komisja może wnieść projekt uchwały o wyrażeniu sprzeciwu wobec tego wniosku."
Art. 148cb,2,"Do projektu uchwały, o którym mowa w ust. 1, przepisy art. 148ca ust. 2-4 stosuje się odpowiednio."
Art. 148cc,1,"Komisja lub grupa co najmniej 15 posłów mogą wnieść projekt uchwały w sprawie uznania projektu aktu ustawodawczego Unii Europejskiej za niezgodny z zasadą pomocniczości, o której mowa w art. 5 ust. 3 Traktatu o Unii Europejskiej."
Art. 148cc,2,"Uzasadniona opinia zawierająca powody, dla których Sejm uznaje, że projekt aktu ustawodawczego Unii Europejskiej nie jest zgodny z zasadą pomocniczości, o której mowa w art. 5 ust. 3 Traktatu o Unii Europejskiej, stanowi załącznik do uchwały Sejmu."
Art. 148cc,3,"Pierwsze czytanie projektu uchwały, o którym mowa w ust. 1, odbywa się na posiedzeniu Komisji."
Art. 148cc,4,"Do projektu uchwały, o którym mowa w ust. 1, nie można zgłaszać poprawek w czasie drugiego czytania."
Art. 148cc,5,"W przypadku przyjęcia uchwały, o której mowa w ust. 1, Marszałek Sejmu przesyła uzasadnioną opinię właściwemu organowi Unii Europejskiej."
Art. 148cd,1,"Komisja lub grupa co najmniej 15 posłów mogą wnieść projekt uchwały w sprawie wniesienia do Trybunału Sprawiedliwości Unii Europejskiej skargi w sprawie naruszenia przez akt ustawodawczy Unii Europejskiej zasady pomocniczości, o której mowa w art. 5 ust. 3 Traktatu o Unii Europejskiej."
Art. 148cd,2,"Skarga, o której mowa w ust. 1, stanowi załącznik do uchwały Sejmu."
Art. 148cd,5,"W postępowaniu przed Trybunałem Sprawiedliwości Unii Europejskiej w sprawie naruszenia przez akt ustawodawczy Unii Europejskiej zasady pomocniczości, o której mowa w art. 5 ust. 3 Traktatu o Unii Europejskiej, Sejm jest reprezentowany przez pełnomocnika, którego wyznacza Marszałek Sejmu."
Art. 148cd,6,"W przypadku przyjęcia uchwały, o której mowa w ust. 1, Marszałek Sejmu przesyła Prezesowi Rady Ministrów uchwałę wraz ze skargą oraz dokumentem potwierdzającym udzielenie pełnomocnictwa do reprezentowania Sejmu w postępowaniu przed Trybunałem Sprawiedliwości Unii Europejskiej."
Art. 148ce,1,"Komisja lub grupa co najmniej 15 posłów mogą wnieść projekt uchwały w sprawie cofnięcia skargi, o której mowa w art. 148cd ust. 1."
Art. 148ce,2,"Pierwsze czytanie projektu uchwały, o którym mowa w ust. 1, odbywa się na posiedzeniu Komisji."
Art. 148ce,4,"W przypadku przyjęcia uchwały, o której mowa w ust. 1, pełnomocnik reprezentujący Sejm cofa skargę."
Art. 148cf,1,"Sejm wybiera swoich przedstawicieli do konwentu, o którym mowa w art. 48 ust. 3 Traktatu o Unii Europejskiej."
Art. 148cf,2,"Marszałek Sejmu wyznacza termin na zgłaszanie wniosków w sprawie wyboru przedstawicieli, o których mowa w ust. 1."
Art. 148cf,3,"Wniosek, o którym mowa w ust. 2, może zgłosić grupa co najmniej 15 posłów."
Art. 148cf,4,"Do wniosku, o którym mowa w ust. 2, dołącza się uzasadnienie, dane o kandydacie i jego zgodę na kandydowanie."
Art. 148cf,5,"Wniosek, o którym mowa w ust. 2, składa się Marszałkowi Sejmu."
Art. 148cf,6,"Wniosek, o którym mowa w ust. 2, Marszałek Sejmu kieruje do Komisji w celu zaopiniowania."
Art. 148cf,7,"Opinię w sprawie wniosku, o którym mowa w ust. 2, Komisja przedstawia na piśmie Marszałkowi Sejmu."
Art. 148cf,8,"Marszałek Sejmu zarządza doręczenie posłom druku zawierającego opinię, o której mowa w ust. 7."
Art. 148cf,9,"Rozpatrzenie przez Sejm wniosku, o którym mowa w ust. 2, może się odbyć nie wcześniej niż następnego dnia po dniu doręczenia posłom druku zawierającego opinię, o której mowa w ust. 7."
Art. 148cf,10,"Sejm w szczególnych wypadkach może skrócić postępowanie przez przystąpienie do rozpatrzenia wniosku, o którym mowa w ust. 2:"
Art. 148cf,1,"bez przesyłania go do Komisji,"
Art. 148cf,2,w terminie krótszym niż określony w ust. 9.
Art. 148d,,"W przypadku uzyskania podczas głosowania na posiedzeniu Komisji równej liczby głosów, o przyjęciu lub nieprzyjęciu uchwały rozstrzyga głos przewodniczącego Komisji, jeżeli nie wstrzymał się on od głosowania."
Art. 148e,,"W przypadku gdy postępowania prowadzone przez Komisję nie zostaną zakończone przed upływem kadencji Sejmu, postępowania te mogą być prowadzone przez Komisję powołaną przez Sejm następnej kadencji."
Art. 149,,Komisje sejmowe obradują na posiedzeniach.
Art. 150,1,"Prezydium komisji kolegialnie kieruje pracami komisji, a w szczególności:"
Art. 150,1,"opracowuje projekty planów pracy komisji,"
Art. 150,2,"ustala terminy i porządek dzienny posiedzeń,"
Art. 150,3,"czuwa nad przygotowaniem posiedzeń,"
Art. 150,4,"zapewnia członkom komisji otrzymywanie w odpowiednim czasie należycie przygotowanych materiałów,"
Art. 150,5,wyznacza sprawozdawców (referentów) na posiedzenia komisji.
Art. 150,2,"Prezydium komisji, opracowując projekty planów pracy komisji oraz ustalając porządek dzienny posiedzenia, bierze pod uwagę wnioski klubów i kół poselskich oraz poszczególnych posłów."
Art. 150,3,Prezydium komisji informuje Prezydium Sejmu o przebiegu prac komisji.
Art. 150,4,"Prezydium komisji może zwrócić się do właściwych organów, instytucji i organizacji o przedstawienie stanowiska w sprawie wniosku lub uwagi wypowiedzianej przez posła w toku posiedzenia komisji."
Art. 150,5,Prezydium komisji podejmuje uchwały większością głosów. W wypadku równej liczby głosów decyduje głos przewodniczącego komisji.
Art. 151,1,Komisje sejmowe na swych posiedzeniach w szczególności:
Art. 151,1,"rozpatrują projekty ustaw i uchwał,"
Art. 151,2,"rozpatrują przekazane im uchwały Senatu o wniesieniu poprawek do tekstu ustawy uchwalonej przez Sejm lub jej odrzuceniu oraz wnioski Prezydenta o ponowne rozpatrzenie ustawy przez Sejm,"
Art. 151,3,"rozpatrują i opiniują założenia projektów ustaw i uchwał,"
Art. 151,4,"rozpatrują sprawozdania i informacje ministrów oraz kierowników naczelnych organów administracji państwowej, a także kierowników innych urzędów i instytucji państwowych,"
Art. 151,5,"analizują działalność poszczególnych działów administracji i gospodarki państwowej,"
Art. 151,6,"rozpatrują sprawy związane z wprowadzeniem w życie i wykonywaniem ustaw i uchwał Sejmu, a także z realizacją uchwalonych przez siebie dezyderatów,"
Art. 151,7,"opiniują, skierowane przez Marszałka Sejmu, wnioski w sprawie wyboru, powołania lub odwołania przez Sejm poszczególnych osób na określone stanowiska państwowe."
Art. 151,2,Do porządku głosowania projektów ustaw i uchwał na posiedzeniu komisji stosuje się odpowiednio art. 50.
Art. 151,3,Obradami komisji kieruje przewodniczący; w razie nieobecności przewodniczącego obradami komisji kieruje jeden z jego zastępców.
Art. 152,1,"Posiedzenia komisji odbywają się w terminach określonych przez samą komisję, jej prezydium lub przewodniczącego."
Art. 152,2,"Na pisemny wniosek co najmniej jednej trzeciej ogólnej liczby członków komisji przewodniczący komisji obowiązany jest zwołać posiedzenie komisji w celu rozpatrzenia określonej sprawy. Zwołując posiedzenie w tym trybie, przewodniczący komisji wyznacza termin posiedzenia tak, aby posiedzenie odbyło się w terminie 30 dni od dnia złożenia wniosku, o którym mowa w zdaniu pierwszym."
Art. 152,3,"Prezydium Sejmu może zwołać posiedzenie komisji w celu rozpatrzenia określonej sprawy, wyznaczając jego termin. Posiedzeniu zwołanemu w tym trybie może przewodniczyć Marszałek Sejmu. Przepisu ust. 5 zdanie drugie nie stosuje się."
Art. 152,4,"O terminie i porządku dziennym posiedzenia komisji przewodniczący komisji zawiadamia Marszałka Sejmu, który może nie wyrazić zgody na odbycie posiedzenia komisji."
Art. 152,5,"54) O terminie i porządku dziennym posiedzenia komisji zawiadamia się członków komisji, Prezydium Sejmu, Najwyższą Izbę Kontroli oraz zainteresowane organy państwowe. Zawiadomienie członków komisji powinno nastąpić co najmniej na 3 dni przed posiedzeniem komisji, na zasadach i w trybie określonych przez Prezydium Sejmu, chyba że posiedzenie zwołane zostało w wyniku decyzji podjętych na posiedzeniu Sejmu."
Art. 153,1,"55) Na żądanie prezydium komisji ministrowie oraz kierownicy naczelnych organów administracji państwowej, a także kierownicy innych urzędów i instytucji państwowych są obowiązani przedstawiać sprawozdania i udzielać informacji oraz uczestniczyć w posiedzeniach komisji, na których rozpatrywane są sprawy dotyczące ich zakresu działania. Osoby te mogą upoważnić pisemnie swego przedstawiciela do udziału w posiedzeniu."
Art. 153,2,Prezydium komisji lub jej przewodniczący może zaprosić inne osoby niż wymienione w ust. 1 do wzięcia udziału w posiedzeniu w celu złożenia informacji i wyjaśnień w sprawach będących przedmiotem obrad lub badań komisji.
Art. 153,3,"Przedstawiciel Najwyższej Izby Kontroli, który uczestniczy w posiedzeniu komisji, może zgłaszać uwagi do sprawozdań i informacji przedkładanych komisji przez przedstawicieli Rządu bądź inne osoby uczestniczące w posiedzeniu, a na żądanie komisji udziela wyjaśnień w sprawach kontroli przeprowadzonych przez Najwyższą Izbę Kontroli."
Art. 154,1,"W posiedzeniach komisji, w tym również zamkniętych, mogą uczestniczyć posłowie niebędący jej członkami. Mogą oni zabierać głos w dyskusji i składać wnioski bez prawa udziału w głosowaniu."
Art. 154,1, W posiedzeniach komisji mogą uczestniczyć wybrani w Rzeczypospolitej Polskiej posłowie do Parlamentu Europejskiego. Mogą oni zabierać głos w dyskusji.
Art. 154,2,Przepis ust. 1 i 1a nie dotyczy Komisji Odpowiedzialności Konstytucyjnej oraz komisji śledczych powoływanych na podstawie art. 111 Konstytucji.
Art. 154,2," W posiedzeniach komisji, na których rozpatrywane są projekty ustaw, mogą, z zastrzeżeniem ust. 2b, uczestniczyć osoby wykonujące zawodową działalność lobbingową oraz osoby uprawnione do reprezentowania podmiotu wykonującego zawodową działalność lobbingową. Mogą one zabierać głos w dyskusji."
Art. 154,2," Do osób, o których mowa w ust. 2a, przepisy art. 155 ust. 1-4 stosuje się odpowiednio."
Art. 154,2," Do udziału osób, o których mowa w ust. 2a, w posiedzeniu, na którym przeprowadza się wysłuchanie publiczne, mają zastosowanie przepisy rozdziału 1a."
Art. 154,2," Osoby, o których mowa w ust. 2a, nie mają prawa uczestnictwa w posiedzeniach podkomisji."
Art. 154,3,"W posiedzeniu komisji, na zaproszenie prezydium komisji lub jej przewodniczącego, mogą uczestniczyć przedstawiciele organizacji zawodowych i społecznych oraz eksperci komisji, a także inne osoby."
Art. 154,4,Prezydium Sejmu określa zasady i tryb korzystania przez komisje z opinii i ekspertyz.
Art. 154,5,"Na posiedzeniu komisji, za zgodą jej przewodniczącego, mogą być obecni pracownicy biur klubów poselskich oraz dziennikarze prasy, radia i telewizji."
Art. 155,1,"Przewodniczący komisji może zwrócić uwagę posłowi, który w wystąpieniu swoim odbiega od przedmiotu obrad komisji, przywołaniem posła ""do rzeczy"". Po dwukrotnym przywołaniu posła ""do rzeczy"" przewodniczący komisji może odebrać głos posłowi."
Art. 155,2,"Przewodniczący komisji po uprzednim zwróceniu uwagi ma prawo przywołać posła ""do porządku"", jeżeli uniemożliwia on prowadzenie obrad."
Art. 155,3,"W przypadku niezastosowania się przez posła do polecenia przewodniczącego komisji, o którym mowa w ust. 2, przewodniczący komisji ma prawo ponownie przywołać posła ""do porządku"", stwierdzając, że uniemożliwia on prowadzenie obrad."
Art. 155,4,"Przewodniczący komisji ma prawo podjąć decyzję o wykluczeniu posła z posiedzenia komisji, jeżeli poseł nadal uniemożliwia prowadzenie obrad i na tym samym posiedzeniu został już upomniany w trybie ust. 3; poseł wykluczony z posiedzenia komisji jest obowiązany natychmiast opuścić salę, w której odbywa się posiedzenie komisji. Jeżeli poseł nie opuści sali, w której odbywa się posiedzenie komisji, przewodniczący komisji zarządza przerwę w obradach."
Art. 155,5,"Od decyzji przewodniczącego komisji poseł może odwołać się do prezydium komisji, które niezwłocznie rozstrzyga sprawę. Do czasu ostatecznego rozstrzygnięcia sprawy poseł nie bierze udziału w posiedzeniu."
Art. 155,6,"O sposobie załatwienia odwołania prezydium komisji niezwłocznie zawiadamia komisję, jednak nie później niż na następnym posiedzeniu. Decyzja prezydium komisji jest ostateczna."
Art. 156,1,"Komisja może postanowić odbycie posiedzenia zamkniętego, określając osoby, których udział w posiedzeniu jest niezbędny. Ta część posiedzenia, podczas której zapada postanowienie, jest zamknięta."
Art. 156,2,Przewodniczący komisji przyznaje klauzulę tajności dokumentom zawierającym informacje niejawne wytworzonym na posiedzeniu zamkniętym komisji.
Art. 157,,"Na wypowiedziane przez posłów w toku posiedzenia komisji wnioski i uwagi uczestniczący w posiedzeniu przedstawiciele organów państwowych, instytucji i organizacji udzielają odpowiedzi na tym samym lub najbliższym posiedzeniu komisji; w uzasadnionych wypadkach odpowiedź ta może być udzielona w formie pisemnej; o treści nadesłanych odpowiedzi przewodniczący komisji informuje komisję na najbliższym posiedzeniu."
Art. 158,1,"Komisja uchwala dezyderaty, opinie, sprawozdania, a także projekty uchwał, rezolucji, apeli, oświadczeń lub deklaracji Sejmu. Komisja, w drodze uchwały, może przyjąć do wiadomości przedłożoną jej informację bądź stanowisko."
Art. 159,1,"Dezyderat zawiera postulaty komisji w określonych sprawach i może być skierowany do Rady Ministrów lub poszczególnych jej członków, Prezesa Najwyższej Izby Kontroli, Prezesa Narodowego Banku Polskiego, Prokuratora Generalnego oraz Głównego Inspektora Pracy."
Art. 159,2,"Uchwalone przez komisje dezyderaty przedstawiane są przez przewodniczącego komisji Marszałkowi Sejmu, który przesyła je odpowiednim organom."
